{"build":{"binary":"cigar","capability_profile":"workspace-metadata-only","command":["cargo","build","--locked","--release","-p","cigar-cli","--no-default-features","--features","beta-embedded","--target","x86_64-unknown-linux-gnu"],"default_features":false,"enabled_features":["beta-embedded"],"package":"cigar-cli","python_toolchain":"3.14.6","rust_toolchain":"1.92.0","source_revision_environment":"CIGAR_SOURCE_REVISION","target":"x86_64-unknown-linux-gnu"},"channel":"beta","evidence_domain":{"forbidden_ga_schema_versions":["cigar.qualification-evidence.v1","cigar.release-evidence.v1"],"purpose":"cigar-beta-qualification-evidence-v1","release_schema_version":"cigar.beta.release-evidence.v1","schema_version":"cigar.beta.qualification-evidence.v1"},"manifests":{"artifact_matrix":"packaging/beta/artifact-matrix.v1.json","build_projection":"packaging/beta/build-projection/projection.v1.json","capability_policy":"packaging/beta/capability-policy.v1.json","cargo_resolution":"packaging/beta/cargo-resolution.v1.json","product_version":"packaging/beta/product-version.v1.json","qualification_policy":"packaging/beta/qualification-policy.v1.json","source_archives":"packaging/beta/source-archives.v1.json"},"prerelease":true,"product":"cigar","production_ready":false,"profile_id":"cigar.beta.embedded-local.linux-x86_64.v1","schema_version":"cigar.beta.release-profile.v1","signature_domain":{"allowed_purposes":["cigar-beta-qualification-evidence-v1","cigar-beta-release-artifact-v1","cigar-beta-release-checksums-v1","cigar-beta-release-evidence-v1","cigar-beta-release-provenance-v1","cigar-beta-release-sbom-v1","cigar-beta-release-spdx-v1"],"envelope_schema_version":"cigar.signature-envelope.v1","forbidden_ga_purposes":["release-artifact","release-benchmark","release-checksums","release-conformance","release-evidence","release-provenance","release-sbom"]},"support":{"capability_boundary":"workspace-metadata-only","deployment_mode":"embedded-local","host_arch":"x86_64","host_os":"linux","libc":"gnu","minimum_glibc_version":"2.39","network_scope":"no-network-service-surface","qualified_distribution":"ubuntu","qualified_distribution_version":"24.04","runtime_baseline":"ubuntu-24.04-x86_64-glibc-2.39","target_triple":"x86_64-unknown-linux-gnu"},"tag":"v0.1.0-beta.1","version":"0.1.0-beta.1"}
